{"$schema":"https://json-schema.org/draft/2020-12/schema","title":"AWA Generation Task v0.1","description":"","type":"object","required":["contract","task_id","target","inputs","constraints","allowed_layers","validators","budget","authority","status"],"properties":{"contract":{"const":"generation-task.v0.1"},"task_id":{"type":"string","minLength":1},"target":{"type":"object","required":["node_ref","missing_role"],"properties":{"node_ref":{"type":"string","minLength":1},"missing_role":{"type":"string","minLength":1}},"additionalProperties":false},"inputs":{"type":"array","items":{"type":"string","minLength":1},"uniqueItems":true},"constraints":{"type":"array","items":{"type":"string","minLength":1},"uniqueItems":true},"allowed_layers":{"type":"array","items":{"type":"string","enum":["semantic","composition","asset","runtime","presentation"]},"uniqueItems":true,"minItems":1},"validators":{"type":"array","items":{"type":"string","minLength":1},"uniqueItems":true},"budget":{"type":"object","required":["max_attempts","max_cost_units"],"properties":{"max_attempts":{"type":"integer","minimum":1},"max_cost_units":{"type":"integer","minimum":0}},"additionalProperties":false},"authority":{"type":"string","enum":["proposal","candidate_commit","admin_review_required"]},"status":{"type":"string","enum":["pending","running","produced","failed","superseded"]}},"additionalProperties":false,"$id":"urn:awa:schema:generation-task-v0-1"}
